{
  "schema_version": "1.1",
  "updated_at": "2026-08-25T05:37:11Z",
  "examination": {
    "qc-hardening": {
      "skills/qc-core/scripts/qc.py": {
        "status": "EXAMINED",
        "run_id": "2026-08-25T05:27:31Z-1525929",
        "invariant": "compute_verdict is the single verdict algorithm; presence P0 blocks even when fixed; atomic_write_json uses temp+fsync+replace",
        "assumptions": "callers pass a list of finding dicts and the correct p0_policy; dest directories are writable",
        "sequence_risk": "read-modify-write of a ledger is safe because replace is atomic; two writers last-write-wins"
      },
      "skills/qc-core/scripts/verify_ledger.py": {
        "status": "EXAMINED",
        "run_id": "2026-08-25T05:27:31Z-1525929",
        "invariant": "verify() fail-closes on missing or non-JSON ledgers and recomputes verdict via qc.compute_verdict",
        "assumptions": "schema file is readable or jsonschema is optional; qc-all ledgers may state SKIPPED/READY without local recompute",
        "sequence_risk": "calling verify then overwrite is the documented loop; mismatch is a ledger bug not a script bug"
      },
      "skills/qc-core/scripts/verify_skills.py": {
        "status": "EXAMINED",
        "run_id": "2026-08-25T05:27:31Z-1525929",
        "invariant": "landing checks run only when README.md and docs/qc-core.pdf exist at pack root; vendored sibling layouts skip them",
        "assumptions": "SKILLS_DIR is the parent of qc-core; glob qc-*/ finds every specialization next to it",
        "sequence_risk": "running landing checks then skill-contract checks: missing README must not abort the remaining registry",
        "finding_ids": [
          "F1.1"
        ]
      },
      "skills/qc-core/scripts/partition.py": {
        "status": "EXAMINED",
        "run_id": "2026-08-25T05:27:31Z-1525929",
        "invariant": "reexam_set is changed files plus import-graph neighbors already in hot_spots/pass_debt; mixed-language groups are forbidden",
        "assumptions": "git is available for --since; profile JSON is well-formed or the CLI fail-closes",
        "sequence_risk": "truncated profile then --reexam must print FAIL not traceback (including NameError on sys)"
      },
      "skills/qc-core/scripts/suite_rollup.py": {
        "status": "EXAMINED",
        "run_id": "2026-08-25T05:27:31Z-1525929",
        "invariant": "unreadable ledgers fail closed; suite_verdict comes only from qc.suite_verdict",
        "assumptions": "findings-dir contains LEGAL_ORDER json files or they are listed in skipped",
        "sequence_risk": "corrupt ledger then rollup must not emit a partial _rollup.json"
      },
      "skills/qc-core/scripts/write_ledger.py": {
        "status": "EXAMINED",
        "run_id": "2026-08-25T05:27:31Z-1525929",
        "invariant": "write_ledger.py only writes via qc.atomic_write_json; junk stdin/src fails closed",
        "assumptions": "dest parent is creatable; stdin is a JSON object",
        "sequence_risk": "partial stdin then write must not replace dest with truncated JSON"
      },
      "skills/qc-core/scripts/verify_port.py": {
        "status": "EXAMINED",
        "run_id": "2026-08-25T05:27:31Z-1525929",
        "invariant": "verify() reports every missed planted finding; unreadable expected/ledger/profile fail closed",
        "assumptions": "expected.json uses file_substring/severity/what_contains; clean artifacts have substantive invariants",
        "sequence_risk": "bad expected path then --ledger must not traceback"
      },
      "skills/qc-core/scripts/verify_profile.py": {
        "status": "EXAMINED",
        "run_id": "2026-08-25T05:27:31Z-1525929",
        "invariant": "hardening EXAMINED rows require Carmack 5Q or invariant+assumptions+sequence_risk; closed deferred codes only",
        "assumptions": "profile is JSON object schema 1.1",
        "sequence_risk": "verify then render: render must not treat a failing profile as authoritative markdown"
      },
      "skills/qc-core/scripts/render_profile.py": {
        "status": "EXAMINED",
        "run_id": "2026-08-25T05:27:31Z-1525929",
        "invariant": "render_profile.py is generated output; JSON is source of truth; unreadable profile fail-closes",
        "assumptions": "profile keys used by render are optional with empty defaults",
        "sequence_risk": "missing profile then --out must not write a truncated markdown file"
      },
      "skills/qc-all/references/scripts/append_history.py": {
        "status": "EXAMINED",
        "run_id": "2026-08-25T05:27:31Z-1525929",
        "invariant": "history appends one JSON line then trims to max-lines via temp+replace; malformed rollup exits 1",
        "assumptions": "history path parent is writable; rollup has run_id and git_sha",
        "sequence_risk": "crash between append and trim can leave one extra line; next run trims"
      }
    },
    "qc-coherence": {
      "skills/qc-core/scripts/qc.py": {
        "status": "EXAMINED",
        "run_id": "2026-08-25T05:37:11Z-bec33ec",
        "invariant": "qc.py is the only compute_verdict; it imports stdlib only and is the kernel layer"
      },
      "skills/qc-core/scripts/verify_ledger.py": {
        "status": "EXAMINED",
        "run_id": "2026-08-25T05:37:11Z-bec33ec",
        "invariant": "verify_ledger fail-closes on missing/non-JSON ledgers and recomputes via qc.compute_verdict"
      },
      "skills/qc-core/scripts/verify_skills.py": {
        "status": "EXAMINED",
        "run_id": "2026-08-25T05:37:11Z-bec33ec",
        "invariant": "landing checks skip when README.md+docs/qc-core.pdf are absent; skill-contract checks still run"
      },
      "skills/qc-core/scripts/partition.py": {
        "status": "EXAMINED",
        "run_id": "2026-08-25T05:37:11Z-bec33ec",
        "invariant": "import-graph partition never mixes languages; unreadable --profile fail-closes"
      },
      "skills/qc-core/scripts/suite_rollup.py": {
        "status": "EXAMINED",
        "run_id": "2026-08-25T05:37:11Z-bec33ec",
        "invariant": "unreadable ledgers fail closed; suite_verdict comes only from qc.suite_verdict"
      },
      "skills/qc-core/scripts/write_ledger.py": {
        "status": "EXAMINED",
        "run_id": "2026-08-25T05:37:11Z-bec33ec",
        "invariant": "write_ledger only writes via atomic_write_json; junk JSON fail-closes"
      },
      "skills/qc-core/scripts/verify_port.py": {
        "status": "EXAMINED",
        "run_id": "2026-08-25T05:37:11Z-bec33ec",
        "invariant": "port acceptance recovers planted findings; unreadable inputs fail-closed"
      },
      "skills/qc-core/scripts/verify_profile.py": {
        "status": "EXAMINED",
        "run_id": "2026-08-25T05:37:11Z-bec33ec",
        "invariant": "hardening EXAMINED requires Carmack 5Q or compact triple"
      },
      "skills/qc-core/scripts/render_profile.py": {
        "status": "EXAMINED",
        "run_id": "2026-08-25T05:37:11Z-bec33ec",
        "invariant": "markdown is generated; JSON is source of truth; unreadable profile fail-closes"
      },
      "skills/qc-all/references/scripts/append_history.py": {
        "status": "EXAMINED",
        "run_id": "2026-08-25T05:37:11Z-bec33ec",
        "invariant": "history appends one JSON line then trims via temp+replace; ingest failures print FAIL:"
      },
      "skills/qc-all/references/scripts/verify_ledger.py": {
        "status": "EXAMINED",
        "run_id": "2026-08-25T05:37:11Z-bec33ec",
        "invariant": "shim execs qc-core verify_ledger.py with the same argv; no local verdict math"
      },
      "skills/qc-all/references/scripts/verify_skills.py": {
        "status": "EXAMINED",
        "run_id": "2026-08-25T05:37:11Z-bec33ec",
        "invariant": "shim execs qc-core verify_skills.py with the same argv"
      },
      "C1-interfaces": {
        "status": "EXAMINED",
        "run_id": "2026-08-25T05:37:11Z-bec33ec",
        "invariant": "This pack has no abc.ABC or typing.Protocol with 2+ implementations; JSON ingest is an implicit CLI contract, not a Protocol"
      }
    }
  },
  "pass_streaks": {},
  "hot_spots": [
    {
      "artifact": "skills/qc-core/scripts/verify_skills.py",
      "finding_ids": [
        "F1.1"
      ],
      "rationale": "Landing checks assumed pack-root README; vendored sibling layout crashed",
      "runs": 1
    },
    {
      "artifact": "skills/qc-core/scripts/partition.py",
      "finding_ids": [
        "F12.1",
        "F13.1"
      ],
      "rationale": "unguarded JSON ingest plus missing sys import on the error path",
      "runs": 1
    }
  ],
  "pass_debt": [
    {
      "finding_id": "F1.1",
      "found_by": "pass-1",
      "should_have_been": "pass-3",
      "module": "skills/qc-core/scripts/verify_skills.py",
      "why_missed": "Pass 3 inventories FileNotFoundError on read_text per file but did not look at the second parent directory used when qc-core is vendored next to specializations"
    },
    {
      "finding_id": "F12.1",
      "found_by": "pass-12",
      "should_have_been": "pass-3",
      "module": "skills/qc-core/scripts/partition.py",
      "why_missed": "Pass 3 fixed suite_rollup.json.load but did not grep the same unguarded json.loads ingest in render_profile, verify_port, partition, and write_ledger"
    }
  ],
  "deferred": [
    {
      "id": "S3.1",
      "skill": "qc-coherence",
      "severity": "P2",
      "code": "accepted-debt",
      "detail": "five fail-closed JSON ingest copies; no shared helper",
      "related_findings": [
        "S3.1",
        "F12.1"
      ]
    },
    {
      "id": "S4.2",
      "skill": "qc-coherence",
      "severity": "P2",
      "code": "accepted-debt",
      "detail": "no mypy/type-annotation ratchet on qc-core scripts",
      "related_findings": [
        "S4.2"
      ]
    }
  ],
  "run_history": [
    {
      "run_id": "2026-08-25T05:27:31Z-1525929",
      "skill": "qc-hardening",
      "verdict": "READY_WITH_DEBT",
      "findings": {